{
  "applications": [
    {
      "assessment": {
        "analyzedAt": "2026-09-10T10:00:00Z",
        "confidence": "high",
        "counterevidence": [],
        "evidence": [
          {
            "commit": "bbbbbbbbbbbbbbbbbbbbbbbbbbbbbbbbbbbbbbbb",
            "kind": "repository",
            "lines": "10-22",
            "observationId": "6666666666666666666666666666666666666666666666666666666666666666",
            "path": "src/main/java/example/customers/CustomerApplication.java",
            "repositoryId": "customer-service",
            "sourceSelectionId": "customer-service-root"
          }
        ],
        "status": "confirmed"
      },
      "id": "customer-management",
      "name": "Customer Management",
      "purpose": "Maintain the customer information needed to fulfil orders."
    },
    {
      "assessment": {
        "analyzedAt": "2026-09-10T10:00:00Z",
        "confidence": "high",
        "counterevidence": [],
        "evidence": [
          {
            "commit": "aaaaaaaaaaaaaaaaaaaaaaaaaaaaaaaaaaaaaaaa",
            "kind": "repository",
            "lines": "12-24",
            "observationId": "1111111111111111111111111111111111111111111111111111111111111111",
            "path": "src/main/java/example/orders/OrderApplication.java",
            "repositoryId": "order-service",
            "sourceSelectionId": "order-service-root"
          }
        ],
        "status": "confirmed"
      },
      "id": "order-management",
      "name": "Order Management",
      "purpose": "Accept and coordinate customer orders through fulfilment."
    }
  ],
  "boundedContexts": [
    {
      "assessment": {
        "analyzedAt": "2026-09-10T10:00:00Z",
        "confidence": "medium",
        "counterevidence": [],
        "evidence": [
          {
            "kind": "curated",
            "locator": "Bounded context discussion",
            "recordedAt": "2026-09-10T10:00:00Z",
            "sourceId": "strategy-interview-2026-09-10",
            "sourceType": "interview",
            "suppliedBy": "Technical lead"
          }
        ],
        "status": "confirmed"
      },
      "description": "Coordinates an accepted order until it is ready for downstream fulfilment.",
      "id": "order-fulfilment",
      "name": "Order Fulfilment"
    }
  ],
  "deployables": [
    {
      "assessment": {
        "analyzedAt": "2026-09-10T10:00:00Z",
        "confidence": "high",
        "counterevidence": [],
        "evidence": [
          {
            "commit": "bbbbbbbbbbbbbbbbbbbbbbbbbbbbbbbbbbbbbbbb",
            "kind": "repository",
            "lines": "8",
            "observationId": "7777777777777777777777777777777777777777777777777777777777777777",
            "path": "build.gradle",
            "repositoryId": "customer-service",
            "sourceSelectionId": "customer-service-root"
          }
        ],
        "status": "confirmed"
      },
      "id": "customer-api",
      "kind": "service",
      "name": "Customer API"
    },
    {
      "assessment": {
        "analyzedAt": "2026-09-10T10:00:00Z",
        "confidence": "high",
        "counterevidence": [],
        "evidence": [
          {
            "commit": "aaaaaaaaaaaaaaaaaaaaaaaaaaaaaaaaaaaaaaaa",
            "kind": "repository",
            "lines": "12",
            "observationId": "2222222222222222222222222222222222222222222222222222222222222222",
            "path": "build.gradle",
            "repositoryId": "order-service",
            "sourceSelectionId": "order-service-root"
          }
        ],
        "status": "confirmed"
      },
      "id": "order-api",
      "kind": "service",
      "name": "Order API"
    },
    {
      "assessment": {
        "analyzedAt": "2026-09-10T10:00:00Z",
        "confidence": "medium",
        "counterevidence": [],
        "evidence": [
          {
            "commit": "aaaaaaaaaaaaaaaaaaaaaaaaaaaaaaaaaaaaaaaa",
            "kind": "repository",
            "lines": "8-19",
            "observationId": "3333333333333333333333333333333333333333333333333333333333333333",
            "path": "src/main/java/example/orders/expiry/ExpiryWorker.java",
            "repositoryId": "order-service",
            "sourceSelectionId": "order-service-root"
          }
        ],
        "status": "inferred"
      },
      "id": "order-expiry-worker",
      "kind": "scheduled-process",
      "name": "Order Expiry Worker"
    }
  ],
  "openQuestions": [
    "Does reservation have the same meaning in the Inventory bounded context?",
    "Should domain experts confirm the inferred Order Expiry Worker boundary?"
  ],
  "relationships": [
    {
      "assessment": {
        "analyzedAt": "2026-09-10T10:00:00Z",
        "confidence": "high",
        "counterevidence": [],
        "evidence": [
          {
            "commit": "bbbbbbbbbbbbbbbbbbbbbbbbbbbbbbbbbbbbbbbb",
            "kind": "repository",
            "lines": "10-22",
            "observationId": "6666666666666666666666666666666666666666666666666666666666666666",
            "path": "src/main/java/example/customers/CustomerApplication.java",
            "repositoryId": "customer-service",
            "sourceSelectionId": "customer-service-root"
          }
        ],
        "status": "confirmed"
      },
      "id": "customer-management-comprises-customer-api",
      "source": {
        "entityId": "customer-management",
        "entityType": "application"
      },
      "statement": "Customer Management comprises the Customer API deployable.",
      "target": {
        "entityId": "customer-api",
        "entityType": "deployable"
      },
      "type": "application-comprises-deployable"
    },
    {
      "assessment": {
        "analyzedAt": "2026-09-10T10:00:00Z",
        "confidence": "high",
        "counterevidence": [],
        "evidence": [
          {
            "commit": "aaaaaaaaaaaaaaaaaaaaaaaaaaaaaaaaaaaaaaaa",
            "kind": "repository",
            "lines": "12-24",
            "observationId": "1111111111111111111111111111111111111111111111111111111111111111",
            "path": "src/main/java/example/orders/OrderApplication.java",
            "repositoryId": "order-service",
            "sourceSelectionId": "order-service-root"
          }
        ],
        "status": "confirmed"
      },
      "id": "order-management-comprises-order-api",
      "source": {
        "entityId": "order-management",
        "entityType": "application"
      },
      "statement": "Order Management comprises the Order API deployable.",
      "target": {
        "entityId": "order-api",
        "entityType": "deployable"
      },
      "type": "application-comprises-deployable"
    },
    {
      "assessment": {
        "analyzedAt": "2026-09-10T10:00:00Z",
        "confidence": "medium",
        "counterevidence": [],
        "evidence": [
          {
            "commit": "aaaaaaaaaaaaaaaaaaaaaaaaaaaaaaaaaaaaaaaa",
            "kind": "repository",
            "lines": "8-19",
            "observationId": "3333333333333333333333333333333333333333333333333333333333333333",
            "path": "src/main/java/example/orders/expiry/ExpiryWorker.java",
            "repositoryId": "order-service",
            "sourceSelectionId": "order-service-root"
          }
        ],
        "status": "inferred"
      },
      "id": "order-management-comprises-order-expiry-worker",
      "source": {
        "entityId": "order-management",
        "entityType": "application"
      },
      "statement": "Order Management appears to comprise the Order Expiry Worker deployable.",
      "target": {
        "entityId": "order-expiry-worker",
        "entityType": "deployable"
      },
      "type": "application-comprises-deployable"
    },
    {
      "assessment": {
        "analyzedAt": "2026-09-10T10:00:00Z",
        "confidence": "medium",
        "counterevidence": [],
        "evidence": [
          {
            "kind": "curated",
            "locator": "Capability mapping",
            "recordedAt": "2026-09-10T10:00:00Z",
            "sourceId": "strategy-interview-2026-09-10",
            "sourceType": "interview",
            "suppliedBy": "Technical lead"
          }
        ],
        "status": "confirmed"
      },
      "id": "order-management-contributes-to-faster-fulfilment",
      "source": {
        "entityId": "order-management",
        "entityType": "application"
      },
      "statement": "Order Management contributes to faster fulfilment by coordinating order progress.",
      "target": {
        "entityId": "faster-fulfilment",
        "entityType": "strategic-capability"
      },
      "type": "application-contributes-to-strategic-capability"
    },
    {
      "assessment": {
        "analyzedAt": "2026-09-10T10:00:00Z",
        "confidence": "medium",
        "counterevidence": [
          {
            "commit": "aaaaaaaaaaaaaaaaaaaaaaaaaaaaaaaaaaaaaaaa",
            "kind": "repository",
            "lines": "5-16",
            "observationId": "4444444444444444444444444444444444444444444444444444444444444444",
            "path": "src/main/java/example/orders/billing/BillingAdapter.java",
            "repositoryId": "order-service",
            "sourceSelectionId": "order-service-root"
          }
        ],
        "evidence": [
          {
            "kind": "curated",
            "locator": "Bounded context discussion",
            "recordedAt": "2026-09-10T10:00:00Z",
            "sourceId": "strategy-interview-2026-09-10",
            "sourceType": "interview",
            "suppliedBy": "Technical lead"
          }
        ],
        "status": "inferred"
      },
      "id": "order-management-participates-in-order-fulfilment",
      "source": {
        "entityId": "order-management",
        "entityType": "application"
      },
      "statement": "Order Management primarily participates in Order Fulfilment, with a billing boundary requiring review.",
      "target": {